{
  "$schema": "https://json-schema.org/draft/2020-12/schema",
  "$id": "https://eclipse-score.github.io/docs-as-code/traceability-metrics-schema.json",
  "title": "Traceability Metrics Schema",
  "description": "Schema for traceability metrics generated by the documentation build.",
  "type": "object",
  "additionalProperties": false,
  "required": [
    "schema_version",
    "generated_by",
    "overall_metrics",
    "metrics_by_type",
    "tests"
  ],
  "properties": {
    "schema_version": {
      "type": "string",
      "const": "2",
      "description": "Version of this metrics schema."
    },
    "generated_by": {
      "type": "string",
      "minLength": 1,
      "description": "Identifier of the producer that generated this metrics file."
    },
    "overall_metrics": {
      "$ref": "#/$defs/requirementMetrics"
    },
    "metrics_by_type": {
      "type": "object",
      "description": "Mapping from need type (for example, tool_req) to requirement metrics.",
      "minProperties": 1,
      "additionalProperties": {
        "$ref": "#/$defs/requirementMetrics"
      },
      "propertyNames": {
        "type": "string",
        "minLength": 1
      }
    },
    "tests": {
      "$ref": "#/$defs/testMetrics"
    },
    "verification_metrics": {
      "type": "object",
      "description": "Per-component verification status and coverage metrics for verification reports.",
      "additionalProperties": {
        "$ref": "#/$defs/componentVerificationMetrics"
      },
      "propertyNames": {
        "type": "string",
        "minLength": 1
      }
    }
  },
  "$defs": {
    "requirementMetrics": {
      "type": "object",
      "additionalProperties": false,
      "required": [
        "total",
        "with_code_link",
        "with_test_link",
        "fully_linked",
        "with_code_link_pct",
        "with_test_link_pct",
        "fully_linked_pct"
      ],
      "properties": {
        "total": {
          "type": "integer",
          "minimum": 0
        },
        "with_code_link": {
          "type": "integer",
          "minimum": 0
        },
        "with_test_link": {
          "type": "integer",
          "minimum": 0
        },
        "fully_linked": {
          "type": "integer",
          "minimum": 0
        },
        "with_code_link_pct": {
          "$ref": "#/$defs/percentage"
        },
        "with_test_link_pct": {
          "$ref": "#/$defs/percentage"
        },
        "fully_linked_pct": {
          "$ref": "#/$defs/percentage"
        }
      }
    },
    "testMetrics": {
      "type": "object",
      "additionalProperties": false,
      "required": [
        "total",
        "linked_to_requirements",
        "linked_to_requirements_pct",
        "broken_references"
      ],
      "properties": {
        "total": {
          "type": "integer",
          "minimum": 0
        },
        "linked_to_requirements": {
          "type": "integer",
          "minimum": 0
        },
        "linked_to_requirements_pct": {
          "$ref": "#/$defs/percentage"
        },
        "broken_references": {
          "type": "array",
          "items": {
            "$ref": "#/$defs/brokenReference"
          }
        }
      }
    },
    "brokenReference": {
      "type": "object",
      "additionalProperties": false,
      "required": [
        "testcase",
        "missing_need"
      ],
      "properties": {
        "testcase": {
          "type": "string",
          "minLength": 1
        },
        "missing_need": {
          "type": "string",
          "minLength": 1
        }
      }
    },
    "percentage": {
      "type": "number",
      "minimum": 0,
      "maximum": 100
    },
    "componentVerificationMetrics": {
      "type": "object",
      "description": "Verification metrics for a single component.",
      "additionalProperties": false,
      "properties": {
        "requirements": {
          "$ref": "#/$defs/statusAndCoverageMetrics"
        },
        "architecture": {
          "$ref": "#/$defs/statusAndCoverageMetrics"
        }
      }
    },
    "statusAndCoverageMetrics": {
      "type": "object",
      "description": "Status distribution and test coverage metrics.",
      "additionalProperties": false,
      "properties": {
        "status": {
          "type": "object",
          "description": "Count by status value.",
          "additionalProperties": false,
          "properties": {
            "valid": {
              "type": "integer",
              "minimum": 0
            },
            "valid_inspected": {
              "type": "integer",
              "minimum": 0
            },
            "invalid": {
              "type": "integer",
              "minimum": 0
            }
          }
        },
        "coverage": {
          "type": "object",
          "description": "Test coverage by verification links.",
          "additionalProperties": false,
          "properties": {
            "fully_covered": {
              "type": "integer",
              "minimum": 0,
              "description": "Items with fully_verifies_back link."
            },
            "partially_covered": {
              "type": "integer",
              "minimum": 0,
              "description": "Items with only partially_verifies_back link."
            },
            "not_covered": {
              "type": "integer",
              "minimum": 0,
              "description": "Items with no verification links."
            }
          }
        }
      }
    }
  }
}
