{
  "schema_version": "2",
  "generated_by": "sphinx_build",
  "overall_metrics": {
    "total": 69,
    "with_code_link": 40,
    "with_test_link": 30,
    "fully_linked": 10,
    "with_code_link_pct": 57.971014492753625,
    "with_test_link_pct": 43.47826086956522,
    "fully_linked_pct": 14.492753623188406
  },
  "metrics_by_type": {
    "tool_req": {
      "total": 69,
      "with_code_link": 40,
      "with_test_link": 30,
      "fully_linked": 10,
      "with_code_link_pct": 57.971014492753625,
      "with_test_link_pct": 43.47826086956522,
      "fully_linked_pct": 14.492753623188406
    }
  },
  "tests": {
    "total": 394,
    "linked_to_requirements": 72,
    "linked_to_requirements_pct": 18.274111675126903,
    "broken_references": []
  }
}