{
  "schema_version": "2",
  "generated_by": "sphinx_build",
  "overall_metrics": {
    "total": 72,
    "with_code_link": 35,
    "with_test_link": 50,
    "fully_linked": 23,
    "with_code_link_pct": 48.61111111111111,
    "with_test_link_pct": 69.44444444444444,
    "fully_linked_pct": 31.944444444444443
  },
  "metrics_by_type": {
    "gd_req": {
      "total": 1,
      "with_code_link": 0,
      "with_test_link": 0,
      "fully_linked": 0,
      "with_code_link_pct": 0.0,
      "with_test_link_pct": 0.0,
      "fully_linked_pct": 0.0
    },
    "tool_req": {
      "total": 71,
      "with_code_link": 35,
      "with_test_link": 50,
      "fully_linked": 23,
      "with_code_link_pct": 49.29577464788733,
      "with_test_link_pct": 70.4225352112676,
      "fully_linked_pct": 32.3943661971831
    }
  },
  "tests": {
    "total": 440,
    "linked_to_requirements": 90,
    "linked_to_requirements_pct": 20.454545454545457,
    "broken_references": []
  }
}